{
  "$schema": "http://json-schema.org/draft-07/schema#",
  "$id": "bookings.schema.json",
  "title": "Bookings JSON output",
  "type": "array",
  "items": {
    "type": "object",
    "required": [
      "id",
      "bookingDate",
      "client",
      "tour",
      "event",
      "payments"
    ],
    "properties": {
      "id": {
        "type": "string",
        "minLength": 1
      },
      "bookingDate": {
        "type": "string",
        "pattern": "^\\d{4}-\\d{2}-\\d{2}$"
      },
      "client": {
        "type": "object",
        "required": ["id", "firstName", "lastName"],
        "properties": {
          "id": { "type": "string", "minLength": 1 },
          "firstName": { "type": "string", "minLength": 1 },
          "lastName": { "type": "string", "minLength": 1 }
        },
        "additionalProperties": false
      },
      "tour": {
        "type": "object",
        "required": ["id", "title", "region"],
        "properties": {
          "id": { "type": "string", "minLength": 1 },
          "title": { "type": "string", "minLength": 1 },
          "region": { "type": "string", "minLength": 1 }
        },
        "additionalProperties": false
      },
      "event": {
        "type": "object",
        "required": ["id", "start", "end"],
        "properties": {
          "id": { "type": "string", "minLength": 1 },
          "start": { "type": "string", "pattern": "^\\d{4}-\\d{2}-\\d{2}$" },
          "end": { "type": "string", "pattern": "^\\d{4}-\\d{2}-\\d{2}$" }
        },
        "additionalProperties": false
      },
      "payments": {
        "type": "object",
        "required": ["count", "total", "currency"],
        "properties": {
          "count": { "type": "integer", "minimum": 0 },
          "total": { "type": "number", "minimum": 0 },
          "currency": { "type": "string", "minLength": 1 }
        },
        "additionalProperties": false
      }
    },
    "additionalProperties": false
  }
}
