[{"id":"bk10","bookingDate":"2025-01-03","client":{"id":"c2","firstName":"John","lastName":"Smith"},"tour":{"id":"t4","title":"Gravel Valleys Discovery","region":"Dolomites"},"event":{"id":"e8","start":"2025-07-20","end":"2025-07-23"},"payments":{"count":2,"total":893.09,"currency":"EUR"}},{"id":"bk1","bookingDate":"2025-01-13","client":{"id":"c9","firstName":"Tom","lastName":"Duran"},"tour":{"id":"t1","title":"Castles of the Loire","region":"Loire Valley"},"event":{"id":"e2","start":"2025-06-24","end":"2025-06-26"},"payments":{"count":2,"total":493.02,"currency":"EUR"}},{"id":"bk7","bookingDate":"2025-01-22","client":{"id":"c6","firstName":"Chloe","lastName":"Martin"},"tour":{"id":"t3","title":"Dolomite Peaks Challenge","region":"Dolomites"},"event":{"id":"e5","start":"2025-08-08","end":"2025-08-12"},"payments":{"count":1,"total":649.88,"currency":"EUR"}},{"id":"bk8","bookingDate":"2025-01-28","client":{"id":"c9","firstName":"Tom","lastName":"Duran"},"tour":{"id":"t3","title":"Dolomite Peaks Challenge","region":"Dolomites"},"event":{"id":"e5","start":"2025-08-08","end":"2025-08-12"},"payments":{"count":1,"total":1030.07,"currency":"EUR"}},{"id":"bk12","bookingDate":"2025-02-01","client":{"id":"c1","firstName":"Anne","lastName":"Dupont"},"tour":{"id":"t1","title":"Castles of the Loire","region":"Loire Valley"},"event":{"id":"e2","start":"2025-06-24","end":"2025-06-26"},"payments":{"count":1,"total":300.19,"currency":"EUR"}},{"id":"bk4","bookingDate":"2025-03-03","client":{"id":"c10","firstName":"Isabel","lastName":"Silva"},"tour":{"id":"t2","title":"Loire E-Bike Escape","region":"Loire Valley"},"event":{"id":"e4","start":"2025-06-17","end":"2025-06-18"},"payments":{"count":1,"total":530.91,"currency":"EUR"}},{"id":"bk9","bookingDate":"2025-03-16","client":{"id":"c2","firstName":"John","lastName":"Smith"},"tour":{"id":"t1","title":"Castles of the Loire","region":"Loire Valley"},"event":{"id":"e1","start":"2025-10-04","end":"2025-10-06"},"payments":{"count":1,"total":206.25,"currency":"EUR"}},{"id":"bk3","bookingDate":"2025-03-21","client":{"id":"c6","firstName":"Chloe","lastName":"Martin"},"tour":{"id":"t2","title":"Loire E-Bike Escape","region":"Loire Valley"},"event":{"id":"e4","start":"2025-06-17","end":"2025-06-18"},"payments":{"count":1,"total":314.57,"currency":"EUR"}},{"id":"bk15","bookingDate":"2025-03-29","client":{"id":"c8","firstName":"Eva","lastName":"Keller"},"tour":{"id":"t6","title":"Black Forest Valleys & Lakes","region":"Black Forest"},"event":{"id":"e11","start":"2025-09-12","end":"2025-09-14"},"payments":{"count":1,"total":612.50,"currency":"EUR"}},{"id":"bk16","bookingDate":"2025-04-02","client":{"id":"c3","firstName":"Luca","lastName":"Bianchi"},"tour":{"id":"t6","title":"Black Forest Valleys & Lakes","region":"Black Forest"},"event":{"id":"e12","start":"2025-10-18","end":"2025-10-21"},"payments":{"count":1,"total":488.30,"currency":"EUR"}},{"id":"bk6","bookingDate":"2025-04-03","client":{"id":"c2","firstName":"John","lastName":"Smith"},"tour":{"id":"t1","title":"Castles of the Loire","region":"Loire Valley"},"event":{"id":"e1","start":"2025-10-04","end":"2025-10-06"},"payments":{"count":2,"total":1174.45,"currency":"EUR"}},{"id":"bk5","bookingDate":"2025-04-05","client":{"id":"c3","firstName":"Luca","lastName":"Bianchi"},"tour":{"id":"t3","title":"Dolomite Peaks Challenge","region":"Dolomites"},"event":{"id":"e5","start":"2025-08-08","end":"2025-08-12"},"payments":{"count":2,"total":1242.14,"currency":"EUR"}},{"id":"bk11","bookingDate":"2025-04-07","client":{"id":"c5","firstName":"Sven","lastName":"Larsson"},"tour":{"id":"t2","title":"Loire E-Bike Escape","region":"Loire Valley"},"event":{"id":"e4","start":"2025-06-17","end":"2025-06-18"},"payments":{"count":2,"total":480.56,"currency":"EUR"}},{"id":"bk2","bookingDate":"2025-04-09","client":{"id":"c6","firstName":"Chloe","lastName":"Martin"},"tour":{"id":"t4","title":"Gravel Valleys Discovery","region":"Dolomites"},"event":{"id":"e8","start":"2025-07-20","end":"2025-07-23"},"payments":{"count":2,"total":546.07,"currency":"EUR"}},{"id":"bk17","bookingDate":"2025-05-11","client":{"id":"c1","firstName":"Anne","lastName":"Dupont"},"tour":{"id":"t6","title":"Black Forest Valleys & Lakes","region":"Black Forest"},"event":{"id":"e12","start":"2025-10-18","end":"2025-10-21"},"payments":{"count":1,"total":402.10,"currency":"EUR"}},{"id":"bk13","bookingDate":"2025-05-14","client":{"id":"c4","firstName":"Maria","lastName":"Gonzalez"},"tour":{"id":"t5","title":"Catalonia Coast and Hills","region":"Catalonia"},"event":{"id":"e9","start":"2025-09-05","end":"2025-09-08"},"payments":{"count":2,"total":701.90,"currency":"EUR"}},{"id":"bk14","bookingDate":"2025-06-01","client":{"id":"c7","firstName":"Noah","lastName":"Garcia"},"tour":{"id":"t5","title":"Catalonia Coast and Hills","region":"Catalonia"},"event":{"id":"e9","start":"2025-09-05","end":"2025-09-08"},"payments":{"count":1,"total":355.00,"currency":"EUR"}}]